{
  "$schema": "https://json-schema.org/draft/2020-12/schema",
  "$id": "https://ugtp.dev/schemas/v0.1/events/execution-completed.json",
  "title": "execution.completed",
  "description": "Emitted when execution completes successfully. Stability: FROZEN.",
  "x-ugtp-architecture": {
    "source": "UGTP-ARCH-001",
    "classification": "FROZEN",
    "stabilityLevel": "FROZEN",
    "breakingChangeRisk": "none",
    "relatedADR": ["ADR-0014"],
    "relatedCapability": [],
    "relatedProfile": ["ugtp:profile:core"],
    "relatedFeature": []
  },
  "type": "object",
  "required": ["eventType", "timestamp", "payload"],
  "additionalProperties": false,
  "properties": {
    "eventType": {
      "const": "execution.completed"
    },
    "timestamp": {
      "$ref": "../types.json#/$defs/Timestamp"
    },
    "correlationId": {
      "$ref": "../types.json#/$defs/CorrelationId"
    },
    "payload": {
      "type": "object",
      "required": ["executionId", "intentId", "receiptId"],
      "additionalProperties": false,
      "properties": {
        "executionId": {
          "$ref": "../types.json#/$defs/ExecutionId"
        },
        "intentId": {
          "$ref": "../types.json#/$defs/IntentId"
        },
        "receiptId": {
          "$ref": "../types.json#/$defs/ReceiptId"
        }
      }
    }
  }
}
