{
  "eventType": "execution.completed",
  "timestamp": "2026-01-15T10:30:15Z",
  "correlationId": "cor_a1b2c3d4e5f6a7b8c9d0e1f2a3b4c5d6",
  "payload": {
    "executionId": "exec_a1b2c3d4e5f6a7b8c9d0e1f2a3b4c5d6",
    "intentId": "int_a1b2c3d4e5f6a7b8c9d0e1f2a3b4c5d6",
    "receiptId": "rcpt_a1b2c3d4e5f6a7b8c9d0e1f2a3b4c5d6"
  }
}
